{
  "schema_version": "1.0",
  "spec_version": 1,
  "engine_version": "0.1.0",
  "configuration_sha256": "aaaaaaaaaaaaaaaaaaaaaaaaaaaaaaaaaaaaaaaaaaaaaaaaaaaaaaaaaaaaaaaa",
  "run": {
    "id": "rehearsal-2",
    "started_at": "2026-08-17T08:00:00+00:00",
    "finished_at": "2026-08-17T08:00:02+00:00",
    "duration_ms": 1900,
    "python_version": "3.12.0",
    "platform": "example"
  },
  "reconciliation": "Customer migration rehearsal",
  "description": "Second committed evidence fixture showing improvement without original datasets.",
  "status": "failed",
  "generated_at": "2026-08-17T08:00:02+00:00",
  "inputs": {
    "source": {"path": "legacy-export.csv", "sha256": "bbbbbbbbbbbbbbbbbbbbbbbbbbbbbbbbbbbbbbbbbbbbbbbbbbbbbbbbbbbbbbbb"},
    "target": {"path": "s4-export.csv", "sha256": "dddddddddddddddddddddddddddddddddddddddddddddddddddddddddddddddd"}
  },
  "summary": {
    "source_records": 3,
    "target_records": 3,
    "matched_records": 3,
    "missing_in_target": 0,
    "unexpected_in_target": 0,
    "checks_total": 3,
    "checks_failed": 2,
    "warnings_failed": 0
  },
  "checks": [
    {
      "id": "customer-name",
      "type": "field_match",
      "severity": "error",
      "status": "passed",
      "metrics": {"compared": 3, "mismatches": 0, "max_mismatches": 0, "source_field": "NAME", "target_field": "NAME"},
      "details": [],
      "details_truncated": false
    },
    {
      "id": "country",
      "type": "field_match",
      "severity": "error",
      "status": "failed",
      "metrics": {"compared": 3, "mismatches": 1, "max_mismatches": 0, "source_field": "COUNTRY", "target_field": "COUNTRY"},
      "details": [{"key": "1002", "source": "DE", "target": "US", "normalized_source": "DE", "normalized_target": "US"}],
      "details_truncated": false
    },
    {
      "id": "credit-by-country",
      "type": "aggregate_match",
      "severity": "error",
      "status": "failed",
      "metrics": {"operation": "sum", "groups_compared": 2, "groups_failed": 1, "tolerance": "0", "source_group_by": ["COUNTRY"], "target_group_by": ["COUNTRY"], "source_field": "CREDIT_LIMIT", "target_field": "CREDIT_LIMIT"},
      "details": [{"group": "DE", "source_value": "10000", "target_value": "9800", "absolute_difference": "200", "percentage_difference": "2"}],
      "details_truncated": false
    }
  ]
}
